{
  "schema_version": "carnet.pilot_comparison/2",
  "read_only": true,
  "note": "CURRENT_CARNET is read from assets/ through catalog_audit_readonly.py; nothing under assets/ or lib/ was modified. ONLY_IN_CARNET means 'not found in the evidence collected by this pilot' (the pilot covered selected generations/markets), NOT 'wrong'. Dataset rows are assigned to a model by the deterministic resolver in model_boundaries.py (NOT the app's prefix heuristic): 'Land Cruiser Prado' rows never count as 'Land Cruiser'; rows with an ambiguous qualifier are quarantined (see current_carnet_meta.boundary). Vocabulary is LOCKED (rules/normalization_rules.json -> locked_vocabulary): Petrol canonical, Hybrid separate, AWD != 4WD, transmission family + variant. 'legacy_view' blocks are informational only.",
  "models": [
    {
      "brand": "Ford",
      "model": "Everest",
      "current_carnet_meta": {
        "in_car_catalog_models": true,
        "dataset_family_rows": 11,
        "boundary": {
          "algorithm": "model_boundaries.py (rules/model_boundaries.json)",
          "legacy_family_rows": 11,
          "strict_rows": 11,
          "excluded_rows": 0,
          "excluded_by_reason": {},
          "excluded_examples": {},
          "accepted_by_status": {
            "engine_descriptor": 11
          },
          "accepted_with_flags": []
        },
        "petrol_rows_whose_dataset_name_says_hybrid": 0,
        "dataset_model_names": [
          "Everest 2 0 (214 Hp) 4WD Automatic",
          "Everest 2 0 (214 Hp) Automatic",
          "Everest 2 0d Bi-Turbo (209 Hp) 4x4 Automatic",
          "Everest 2 0d Bi-Turbo (209 Hp) Automatic",
          "Everest 2 0d Turbo (170 Hp) Automatic",
          "Everest 3 0d V6 Turbo (250 Hp) 4x4 Automatic",
          "Everest 3 2 Duratorq TDCi (195 Hp) 4WD Automatic",
          "Everest 3 2 Duratorq TDCi (195 Hp) Automatic",
          "Everest 3 2 DuratorqTDCi (194 Hp) 4WD Automatic",
          "Everest 3 2 DuratorqTDCi (194 Hp) Automatic",
          "Everest 3 2 DuratorqTDCi (194 Hp) Automatic 7 Seat"
        ],
        "dataset_year_span": [
          2015,
          2022
        ]
      },
      "dimensions": {
        "trims": {
          "carnet_stores_field": true,
          "CURRENT_CARNET": [
            "Limited",
            "Mid Range",
            "XLS",
            "XLT"
          ],
          "NEW_VERIFIED": [
            "Ambiente",
            "Limited",
            "Titanium",
            "Trend",
            "XLS",
            "XLT"
          ],
          "NEW_PROVISIONAL_ONLY": [],
          "NEW_NEEDS_SOURCE_RETRIEVAL": [
            "Active",
            "Platinum",
            "Sport",
            "Titanium+",
            "Tremor",
            "Wolftrak"
          ],
          "MATCHED": [
            "Limited",
            "XLS",
            "XLT"
          ],
          "MISSING_FROM_CARNET": [
            "Ambiente",
            "Titanium",
            "Trend"
          ],
          "PROVISIONAL_NOT_IN_CARNET": [],
          "NEEDS_SOURCE_RETRIEVAL_NOT_IN_CARNET": [
            "Active",
            "Platinum",
            "Sport",
            "Titanium+",
            "Tremor",
            "Wolftrak"
          ],
          "CARNET_VALUE_ONLY_PROVISIONAL": [],
          "CARNET_VALUE_ONLY_NEEDS_SOURCE_RETRIEVAL": [],
          "ONLY_IN_CARNET": [
            {
              "value": "Mid Range",
              "dataset_rows": 1
            }
          ],
          "CONFLICTS": []
        },
        "engine_sizes": {
          "carnet_stores_field": true,
          "CURRENT_CARNET": [
            "2.0L",
            "3.0L",
            "3.2L"
          ],
          "NEW_VERIFIED": [
            "2.3L"
          ],
          "NEW_PROVISIONAL_ONLY": [],
          "NEW_NEEDS_SOURCE_RETRIEVAL": [
            "2.0L",
            "2.7L",
            "3.0L",
            "3.2L"
          ],
          "MATCHED": [],
          "MISSING_FROM_CARNET": [
            "2.3L"
          ],
          "PROVISIONAL_NOT_IN_CARNET": [],
          "NEEDS_SOURCE_RETRIEVAL_NOT_IN_CARNET": [
            "2.7L"
          ],
          "CARNET_VALUE_ONLY_PROVISIONAL": [],
          "CARNET_VALUE_ONLY_NEEDS_SOURCE_RETRIEVAL": [
            "2.0L",
            "3.0L",
            "3.2L"
          ],
          "ONLY_IN_CARNET": [],
          "CONFLICTS": [
            {
              "conflict_id": "CF-ford-everest-001",
              "field": "horsepower_hp",
              "engine_group": "2.0L",
              "severity": "possible_year_unspecified",
              "values": [
                [
                  "FE-001",
                  170.0
                ],
                [
                  "FE-010",
                  170.0
                ],
                [
                  "FE-014",
                  168.0
                ]
              ]
            },
            {
              "conflict_id": "CF-ford-everest-002",
              "field": "horsepower_hp",
              "engine_group": "2.7L",
              "severity": "definite",
              "values": [
                [
                  "FE-012",
                  310.0
                ],
                [
                  "FE-019",
                  355.0
                ]
              ]
            },
            {
              "conflict_id": "CF-ford-everest-003",
              "field": "torque_nm",
              "engine_group": "2.7L",
              "severity": "definite",
              "values": [
                [
                  "FE-012",
                  542.0
                ],
                [
                  "FE-019",
                  500.0
                ]
              ]
            }
          ]
        },
        "cylinders": {
          "carnet_stores_field": true,
          "CURRENT_CARNET": [
            4,
            5,
            6
          ],
          "NEW_VERIFIED": [],
          "NEW_PROVISIONAL_ONLY": [],
          "NEW_NEEDS_SOURCE_RETRIEVAL": [
            4,
            5,
            6
          ],
          "MATCHED": [],
          "MISSING_FROM_CARNET": [],
          "PROVISIONAL_NOT_IN_CARNET": [],
          "NEEDS_SOURCE_RETRIEVAL_NOT_IN_CARNET": [],
          "CARNET_VALUE_ONLY_PROVISIONAL": [],
          "CARNET_VALUE_ONLY_NEEDS_SOURCE_RETRIEVAL": [
            4,
            5,
            6
          ],
          "ONLY_IN_CARNET": [],
          "CONFLICTS": []
        },
        "fuel_types": {
          "carnet_stores_field": true,
          "CURRENT_CARNET": [
            "Diesel"
          ],
          "NEW_VERIFIED": [
            "Petrol"
          ],
          "NEW_PROVISIONAL_ONLY": [],
          "NEW_NEEDS_SOURCE_RETRIEVAL": [
            "Diesel"
          ],
          "MATCHED": [],
          "MISSING_FROM_CARNET": [
            "Petrol"
          ],
          "PROVISIONAL_NOT_IN_CARNET": [],
          "NEEDS_SOURCE_RETRIEVAL_NOT_IN_CARNET": [],
          "CARNET_VALUE_ONLY_PROVISIONAL": [],
          "CARNET_VALUE_ONLY_NEEDS_SOURCE_RETRIEVAL": [
            "Diesel"
          ],
          "ONLY_IN_CARNET": [],
          "CONFLICTS": [],
          "legacy_view": {
            "reason": "legacy dataset stores every hybrid as 'Petrol (Gasoline)'",
            "mapping": {
              "Hybrid": "Petrol",
              "Plug-in Hybrid": "Petrol"
            },
            "MISSING_FROM_CARNET": [
              "Petrol"
            ]
          }
        },
        "transmissions": {
          "carnet_stores_field": true,
          "CURRENT_CARNET": [
            "Automatic"
          ],
          "NEW_VERIFIED": [
            "Automatic"
          ],
          "NEW_PROVISIONAL_ONLY": [],
          "NEW_NEEDS_SOURCE_RETRIEVAL": [],
          "MATCHED": [
            "Automatic"
          ],
          "MISSING_FROM_CARNET": [],
          "PROVISIONAL_NOT_IN_CARNET": [],
          "NEEDS_SOURCE_RETRIEVAL_NOT_IN_CARNET": [],
          "CARNET_VALUE_ONLY_PROVISIONAL": [],
          "CARNET_VALUE_ONLY_NEEDS_SOURCE_RETRIEVAL": [],
          "ONLY_IN_CARNET": [],
          "CONFLICTS": []
        },
        "transmission_variants": {
          "carnet_stores_field": false,
          "CURRENT_CARNET": [],
          "NEW_VERIFIED": [
            "SelectShift"
          ],
          "NEW_PROVISIONAL_ONLY": [],
          "NEW_NEEDS_SOURCE_RETRIEVAL": [],
          "MATCHED": [],
          "MISSING_FROM_CARNET": [
            "SelectShift"
          ],
          "PROVISIONAL_NOT_IN_CARNET": [],
          "NEEDS_SOURCE_RETRIEVAL_NOT_IN_CARNET": [],
          "CARNET_VALUE_ONLY_PROVISIONAL": [],
          "CARNET_VALUE_ONLY_NEEDS_SOURCE_RETRIEVAL": [],
          "ONLY_IN_CARNET": [],
          "CONFLICTS": [],
          "note": "CarNet's dataset does not store this attribute; every verified value is new information."
        },
        "transmission_gears": {
          "carnet_stores_field": false,
          "CURRENT_CARNET": [],
          "NEW_VERIFIED": [
            10
          ],
          "NEW_PROVISIONAL_ONLY": [],
          "NEW_NEEDS_SOURCE_RETRIEVAL": [
            6
          ],
          "MATCHED": [],
          "MISSING_FROM_CARNET": [
            10
          ],
          "PROVISIONAL_NOT_IN_CARNET": [],
          "NEEDS_SOURCE_RETRIEVAL_NOT_IN_CARNET": [
            6
          ],
          "CARNET_VALUE_ONLY_PROVISIONAL": [],
          "CARNET_VALUE_ONLY_NEEDS_SOURCE_RETRIEVAL": [],
          "ONLY_IN_CARNET": [],
          "CONFLICTS": [],
          "note": "CarNet's dataset does not store this attribute; every verified value is new information."
        },
        "drivetrains": {
          "carnet_stores_field": true,
          "CURRENT_CARNET": [
            "AWD",
            "RWD"
          ],
          "NEW_VERIFIED": [
            "4WD",
            "RWD"
          ],
          "NEW_PROVISIONAL_ONLY": [],
          "NEW_NEEDS_SOURCE_RETRIEVAL": [],
          "MATCHED": [
            "RWD"
          ],
          "MISSING_FROM_CARNET": [